<?xml version="1.0" encoding="UTF-8"?>
<xs:schema attributeFormDefault="unqualified" elementFormDefault="qualified" xmlns:xs="http://www.w3.org/2001/XMLSchema">
    <xs:simpleType name="PaperMediaType">
        <xs:restriction base="xs:string">
            <xs:enumeration value="Book"></xs:enumeration>
            <xs:enumeration value="Jrnl"></xs:enumeration>
            <xs:enumeration value="Nwsp"></xs:enumeration>
        </xs:restriction>
    </xs:simpleType>

    <xs:element name="Library">
        <xs:complexType>
            <xs:sequence>
                <xs:element name="Seller"></xs:element>
                <xs:element name="ARRAY_PM" minOccurs="0" maxOccurs="unbounded">
                    <xs:complexType>
                        <xs:sequence>
                            <xs:element name="PaperMedia" minOccurs="0" maxOccurs="unbounded">
                                <xs:complexType>
                                    <xs:sequence>
                                        <xs:element type="xs:string" name="YearPublic"/>
                                        <xs:element type="xs:string" name="Pages"/>
                                        <xs:element type="xs:string" name="Price"/>
                                        <xs:element type="xs:string" name="Author"/>
                                        <xs:element type="PaperMediaType" name="PMT"/>
                                        <xs:element type="xs:string" name="Name"/>
                                    </xs:sequence>
                                </xs:complexType>
                            </xs:element>
                        </xs:sequence>
                    </xs:complexType>
                </xs:element>
            </xs:sequence>
        </xs:complexType>
    </xs:element>
</xs:schema>